<?xml version="1.0" encoding="UTF-8"?>
<mbt:BootstrapChangelog xmlns:mbt="http://www.moomoohk.github.io/moobootstrap" xmlns:xsi="http://www.w3.org/2001/XMLSchema-instance" xsi:schemaLocation="http://www.moomoohk.github.io/moobootstrap moobootstrap.xsd ">
  <mbt:RemoteBuildNumber>0</mbt:RemoteBuildNumber>
  <mbt:Builds>
    <mbt:Build BuildNumber="0">
      <mbt:VersionString>1.0</mbt:VersionString>
      <mbt:ChangeList>
        <mbt:Change type="addition">Initial</mbt:Change>
      </mbt:ChangeList>
    </mbt:Build>
    <mbt:Build BuildNumber="1">
      <mbt:VersionString>1.0</mbt:VersionString>
      <mbt:ChangeList>
        <mbt:Change type="other">Initial</mbt:Change>
      </mbt:ChangeList>
    </mbt:Build>
    <mbt:Build BuildNumber="2">
      <mbt:VersionString>1.0</mbt:VersionString>
      <mbt:ChangeList>
        <mbt:Change type="other">Initial</mbt:Change>
      </mbt:ChangeList>
    </mbt:Build>
  </mbt:Builds>
</mbt:BootstrapChangelog>